<!--

Oxygen Webhelp plugin
Copyright (c) 1998-2013 Syncro Soft SRL, Romania.  All rights reserved.
Licensed under the terms stated in the license file EULA_Webhelp.txt 
available in the base directory of this Oxygen Webhelp plugin.

-->

<!ELEMENT strings (str)+>
<!ATTLIST strings xml:lang CDATA #REQUIRED>
<!ELEMENT str (#PCDATA)>
<!ATTLIST str name CDATA #REQUIRED>
<!ATTLIST str js (true|false) 'true'>
<!ATTLIST str php (true|false) 'false'>
